{
  "$schema": "https://json-schema.org/draft/2020-12/schema",
  "$id": "compute-instance-input-v1",
  "title": "Compute Instance IBB - agnostic input contract",
  "type": "object",
  "required": ["request", "buildingBlock", "context", "requirements"],
  "additionalProperties": false,
  "properties": {
    "request": {
      "type": "object",
      "required": ["operation", "requestId"],
      "additionalProperties": false,
      "properties": {
        "operation": { "enum": ["validate", "create", "read", "upgrade", "delete"] },
        "requestId": { "type": "string", "pattern": "^req-[A-Za-z0-9._-]{4,}$" }
      }
    },
    "buildingBlock": {
      "type": "object",
      "required": ["name", "version"],
      "additionalProperties": false,
      "properties": {
        "name": { "const": "compute-instance" },
        "version": { "type": "string", "pattern": "^\\d+\\.\\d+\\.\\d+$" }
      }
    },
    "context": {
      "type": "object",
      "required": [
        "applicationId",
        "environment",
        "platform",
        "costCenter",
        "dataClassification",
        "requesterIdentity",
        "correlationId"
      ],
      "additionalProperties": false,
      "properties": {
        "applicationId": { "type": "string", "pattern": "^APP-[0-9]{3,}$" },
        "environment": { "enum": ["dev", "qua", "tst", "ppr", "prd"] },
        "platform": { "enum": ["aws"] },
        "region": { "type": "string" },
        "costCenter": { "type": "string" },
        "dataClassification": { "enum": ["internal", "confidential"] },
        "requesterIdentity": {
          "type": "string",
          "description": "Authenticated caller identity (a non-human identity for automation) (CON-009)."
        },
        "correlationId": {
          "type": "string",
          "description": "End-to-end traceability across portal, orchestrator, pipeline, IaC, resource (CON-009, EVD-003)."
        },
        "changeReference": {
          "type": "string",
          "description": "Approved change record reference. Required by policy for environment: prd (SBP AWS-008); enforced conditionally in the pipeline, not the schema."
        }
      }
    },
    "requirements": {
      "type": "object",
      "description": "Agnostic, capability-specific knobs, nested by the fixed high-level categories (sizing/access/resilience/security/operations) from requirement-dictionary/requirement-properties.yaml, per scaffold-ibb SKILL.md §1b. Do NOT put dataClassification here — it is a mandatory context field, already required above.",
      "required": ["sizing", "access", "resilience", "security", "operations"],
      "additionalProperties": false,
      "properties": {
        "sizing": {
          "type": "object",
          "required": ["computeTier"],
          "additionalProperties": false,
          "properties": {
            "computeTier": {
              "type": "string",
              "enum": ["small", "medium", "large", "xlarge"],
              "description": "Abstract compute sizing tier — how much vCPU/RAM the instance gets. Never a literal instance type."
            }
          }
        },
        "access": {
          "type": "object",
          "required": ["networkExposure"],
          "additionalProperties": false,
          "properties": {
            "networkExposure": {
              "type": "string",
              "enum": ["private", "public"],
              "description": "Whether the instance is assigned a public IP (public) or stays internal-only (private)."
            }
          }
        },
        "resilience": {
          "type": "object",
          "required": ["availabilityZoneIndex", "terminationProtection"],
          "additionalProperties": false,
          "properties": {
            "availabilityZoneIndex": {
              "type": "integer",
              "minimum": 0,
              "description": "Ordinal zone placement within the region; must resolve to the same zone as the target subnet."
            },
            "terminationProtection": {
              "type": "boolean",
              "description": "Whether the instance is protected against accidental termination via the provider's API."
            }
          }
        },
        "security": {
          "type": "object",
          "required": ["encryptionRequired", "securityGroupProfile"],
          "additionalProperties": false,
          "properties": {
            "encryptionRequired": {
              "type": "boolean",
              "description": "Whether a customer-managed key (via the key-management dependency) is mandatory for the root volume, vs. platform-default encryption. The root volume is always encrypted either way."
            },
            "securityGroupProfile": {
              "type": "string",
              "enum": ["default", "restrictive"],
              "description": "Baseline instance-level security group posture."
            }
          }
        },
        "operations": {
          "type": "object",
          "required": ["subnetId", "osFamily"],
          "additionalProperties": false,
          "properties": {
            "subnetId": {
              "type": "string",
              "description": "Identifier of the subnet (from the subnet capability dependency) this instance is launched into."
            },
            "osFamily": {
              "type": "string",
              "enum": ["linux", "windows"],
              "description": "Operating system family; drives platform-approved base image selection internally. Never a literal AMI id."
            }
          }
        }
      }
    }
  }
}
